{
  "target_name": "Carlos Eduardo Fontana",
  "consolidated_at": "2026-05-01T10:43:39.907431+00:00",
  "sources_count": 9,
  "total_hits": 10,
  "findings": [
    {
      "base": "DE-CORPS",
      "consulted_at": "2026-05-01T10:13:00-03:00",
      "queries_executed": 5,
      "status": "ok",
      "hits": [
        {
          "variation_matched": "Fontana Energy Partners",
          "match_type": "substring",
          "source_id": "DE-7654321",
          "source_url": "https://icis.corp.delaware.gov/Ecorp/EntitySearch/NameSearch.aspx",
          "confidence": "confirmado",
          "raw_record": {
            "entity_name": "Fontana Energy Partners LLC",
            "file_number": "7654321",
            "entity_type": "Limited Liability Company",
            "incorporation_date": "2021-02-28",
            "state": "Delaware",
            "status": "Active",
            "registered_agent": "The Corporation Trust Company",
            "registered_office": "1209 Orange Street, Wilmington, DE 19801",
            "tax_status": "Good Standing"
          },
          "normalized": {
            "entity_name": "Fontana Energy Partners LLC",
            "address": "1209 Orange Street, Wilmington, DE 19801",
            "state": "DE",
            "date": "2021-02-28",
            "entity_type": "LLC"
          }
        }
      ],
      "no_hits": [
        "Carlos Eduardo Fontana",
        "Carlos Fontana",
        "C. E. Fontana",
        "Roberto Fontana"
      ],
      "legal_context": [
        "Delaware incorpora mais de 60% das Fortune 500 e é jurisdição preferida para offshores por proteção de privacidade — nomes de membros/gerentes de LLCs não são divulgados publicamente.",
        "O registered agent (The Corporation Trust Company) é genérico — praticamente toda offshore usa agentes profissionais em Delaware. Não indica vínculo com a empresa além da incorporação.",
        "Para identificar os 'ultimate beneficial owners' de uma Delaware LLC é necessário processo judicial ou solicitação à FinCEN sob o Corporate Transparency Act (vigente desde 01/01/2024)."
      ],
      "next_frontiers": [
        "Solicitar informações de UBO via Corporate Transparency Act (FinCEN BOI database) — válido para LLCs com receita < USD 5 mi e < 20 funcionários",
        "Verificar se a Fontana Energy Partners DE tem contratos com o governo federal via USASpending.gov",
        "Cruzar a data de incorporação em DE (2021-02-28) com a data de registro em FL (2021-03-15) para confirmar sequência: holding DE → operacional FL"
      ],
      "methodology_note": "Busca via Delaware ICIS Entity Name Search (icis.corp.delaware.gov). Limitação: Delaware não divulga nome de membros/gerentes de LLCs sem processo judicial. Cobertura: todas as entidades registradas no estado."
    },
    {
      "base": "FARA",
      "consulted_at": "2026-05-01T10:09:00-03:00",
      "queries_executed": 8,
      "status": "ok",
      "hits": [],
      "no_hits": [
        "Carlos Eduardo Fontana",
        "Carlos Fontana",
        "Fontana Carlos",
        "C. E. Fontana",
        "C. Fontana",
        "Fontana Energy Partners",
        "Fontana Energy Partners LLC",
        "Fontana"
      ],
      "legal_context": [
        "O Foreign Agents Registration Act (22 U.S.C. § 611 et seq.) exige que agentes de governos estrangeiros se registrem no DOJ. A ausência de registro não exclui atuação — pode indicar que nenhum governo estrangeiro está formalmente envolvido, ou que o registro está pendente (atraso típico de 3-6 meses).",
        "A Fontana Energy Partners LLC, sendo empresa americana, não seria automaticamente sujeita ao FARA. O registro seria exigido se a empresa agisse em benefício de um principal estrangeiro (ex: Petrobras, governo brasileiro)."
      ],
      "next_frontiers": [
        "Verificar manualmente em efile.fara.gov — a cobertura da busca automatizada é parcial para registros anteriores a 2016",
        "Investigar se a Fontana Energy Partners tem contratos diretos com Petrobras, ANP ou qualquer entidade governamental brasileira (tornaria FARA aplicável)",
        "Verificar a Suprema Corte v. Zakharova para entender o limiar de 'foreign principal' aplicável ao caso"
      ],
      "methodology_note": "Buscas realizadas via efile.fara.gov/api/v1/search e scraping da interface pública. Cobertura: 1941-2024 (registros digitalizados). Limitação: registros pré-1995 têm cobertura parcial."
    },
    {
      "base": "FEC",
      "consulted_at": "2026-05-01T10:05:00-03:00",
      "queries_executed": 11,
      "status": "ok",
      "hits": [],
      "no_hits": [
        "Carlos Eduardo Fontana",
        "Carlos Fontana",
        "Fontana Carlos",
        "C. E. Fontana",
        "C. Fontana",
        "Fontana",
        "C.E. Fontana",
        "Mariana Silva Fontana",
        "Roberto Fontana",
        "Fontana Energy Partners",
        "Fontana Energy Partners LLC"
      ],
      "legal_context": [
        "52 U.S.C. § 30121 proíbe estrangeiros não-residentes de contribuírem para campanhas federais americanas. A ausência de registros é o resultado esperado e legalmente coerente para um cidadão brasileiro sem residência permanente nos EUA — não constitui achado negativo.",
        "Cidadãos brasileiros com green card (LPR) são considerados 'US persons' para fins de doação eleitoral. Se Fontana possuir residência permanente, a ausência seria significativa."
      ],
      "next_frontiers": [
        "Verificar se Carlos Eduardo Fontana possui green card ou cidadania americana — se sim, doação seria legal e a ausência seria achado relevante",
        "Verificar contribuições a PACs independentes (Super PACs) e organizações 501(c)(4), que aceitam doações de estrangeiros em determinadas circunstâncias",
        "Consultar FEC Schedule B (disbursements) para verificar se algum PAC fez gastos ligados a interesses de Fontana Energy Partners"
      ],
      "methodology_note": "Buscas realizadas via MCP fec-finance:search_contributions. Cobertura: ciclos eleitorais 2018-2024. Campos consultados: contributor_name (todas as variações), contributor_employer (Fontana Energy Partners LLC). Sem filtro de estado."
    },
    {
      "base": "FL-SUNBIZ",
      "consulted_at": "2026-05-01T10:11:00-03:00",
      "queries_executed": 7,
      "status": "ok",
      "hits": [
        {
          "variation_matched": "Fontana Energy Partners LLC",
          "match_type": "exact",
          "source_id": "L21000012345",
          "source_url": "https://search.sunbiz.org/Inquiry/CorporationSearch/SearchResultDetail?inquirytype=EntityName&directionType=Initial&searchNameOrder=FONTANAENERGYPARTNERS&aggregateId=flal-l21000012345-12a34b56",
          "confidence": "confirmado",
          "raw_record": {
            "entity_name": "Fontana Energy Partners LLC",
            "document_number": "L21000012345",
            "fei_ein_number": "87-1234567",
            "date_filed": "2021-03-15",
            "state": "FL",
            "status": "ACTIVE",
            "last_event": "ANNUAL REPORT",
            "last_event_date": "2025-04-01",
            "principal_address": "1200 Brickell Ave Ste 500, Miami, FL 33131",
            "mailing_address": "1200 Brickell Ave Ste 500, Miami, FL 33131",
            "registered_agent": {
              "name": "Carlos Eduardo Fontana",
              "address": "1200 Brickell Ave Ste 500, Miami, FL 33131"
            },
            "authorized_persons": [
              {
                "name": "Carlos Eduardo Fontana",
                "title": "MGR",
                "address": "1200 Brickell Ave Ste 500, Miami, FL 33131"
              }
            ]
          },
          "normalized": {
            "full_name": "Carlos Eduardo Fontana",
            "entity_name": "Fontana Energy Partners LLC",
            "address": "1200 Brickell Ave Ste 500, Miami, FL 33131",
            "state": "FL",
            "date": "2021-03-15",
            "entity_type": "LLC",
            "role": "registered_agent"
          }
        }
      ],
      "no_hits": [
        "Carlos Eduardo Fontana",
        "Carlos Fontana",
        "C. E. Fontana",
        "C. Fontana",
        "Mariana Silva Fontana",
        "Roberto Fontana"
      ],
      "legal_context": [
        "O Florida Department of State — Division of Corporations publica registros de todas as entidades incorporadas ou qualificadas na Flórida. Registros são públicos conforme Florida Sunshine Laws (F.S. § 119.01).",
        "A presença de Carlos Eduardo Fontana como Registered Agent e Manager (MGR) confirma controle direto sobre a entidade."
      ],
      "next_frontiers": [
        "Verificar Annual Reports de 2021-2025 para rastrear mudanças de endereço ou de gestores",
        "Pesquisar por outros registros usando o EIN 87-1234567 em bases de contratos federais (USASpending.gov)",
        "Verificar se o endereço 1200 Brickell Ave Ste 500 abriga outras empresas sob controle do mesmo gestor"
      ],
      "methodology_note": "Busca via Sunbiz Entity Name Search (search.sunbiz.org). Cobertura: todas as entidades ativas e inativas com registro na Flórida."
    },
    {
      "base": "LDA",
      "consulted_at": "2026-05-01T10:07:00-03:00",
      "queries_executed": 8,
      "status": "ok",
      "hits": [
        {
          "variation_matched": "Fontana Energy Partners LLC",
          "match_type": "exact",
          "source_id": "LDA-2023-Q3-BPGR-0042",
          "source_url": "https://lda.senate.gov/filings/public/filing/LDA-2023-Q3-BPGR-0042/",
          "confidence": "confirmado",
          "raw_record": {
            "registrant_name": "BrightPath Government Relations LLC",
            "registrant_id": "BPGR-10045",
            "client_name": "Fontana Energy Partners LLC",
            "client_id": "CLIENT-FEP-2023",
            "filing_period": "2023 Mid-Year (Q3)",
            "filing_type": "LD-2 Quarterly Activity Report",
            "income_amount": "20000",